enunciado,area
"
QUESTÃO 88
A magnetohipertermia é um procedimento terapêutico 
que se baseia na elevação da temperatura das células 

por um tumor. Nesse tipo de tratamento, nanopartículas 
magnéticas são fagocitadas pelas células tumorais, e 
um campo magnético alternado externo é utilizado para 
promover a agitação das nanopartículas e consequente 
aquecimento da célula.
A elevação de temperatura descrita ocorre porque
A o campo magnético gerado pela oscilação das 
nanopartículas é absorvido pelo tumor.
B o campo magnético alternado faz as nanopartículas 
girarem, transferindo calor por atrito.
C as nanopartículas interagem magneticamente com as 
células do corpo, transferindo calor.
D o campo magnético alternado fornece calor para as 
nanopartículas que o transfere às células do corpo.
E as nanopartículas são aceleradas em um único sentido 
em razão da interação com o campo magnético, 
fazendo-as colidir com as células e transferir calor.",ciências da natureza
"
QUESTÃO 89
O aquecimento de um material por irradiação com 
micro-ondas ocorre por causa da interação da onda 
eletromagnética com o dipolo elétrico da molécula.
Um importante atributo do aquecimento por micro-ondas 
é a absorção direta da energia pelo material a ser 
aquecido. Assim, esse aquecimento é seletivo e 
dependerá, principalmente, da constante dielétrica e da 

taxa de aquecimento de cinco solventes sob irradiação 
de micro-ondas.
Água
M etanol
Etanol
Propanol
n-Hexano
0          10         20         30        40         50         60         70         80
100
80
60
40
20
Tem peratura (°C)
Tem po (s)
BARBOZA, A. C. R. N. et al. Aquecimento em forno de micro-ondas. Desenvolvimento de 
alguns conceitos fundamentais. Química Nova, n. 6, 2001 (adaptado).
No gráfico, qual solvente apresenta taxa média de 
aquecimento mais próxima de zero, no intervalo de 
0 s a 40 s?
A H2O
B CH3OH
C CH3CH2OH
D CH3CH2CH2OH
E CH3CH2CH2CH2CH2CH3",ciências da natureza
"
QUESTÃO 91 
Disponível em: www.seton.com. Acesso em: 28 fev. 2012.
Placas como a da gravura são usadas para orientar 
os usuários de um espaço urbano. Essa placa, 
especificamente, tem a função de avisar que somente
A as despesas feitas com estacionamento são 
deduzidas.
B os donos de carro entram no estacionamento do 
parque.
C o proprietário autoriza a validação do estacionamento.
D os rebocadores precisam de permissão para entrar 
no local.
E os veículos autorizados podem estacionar naquela 
área.",UNDEFINED
"
QUESTÃO 92 
The art of happiness
Nearly every time you see him, he’s laughing or at 
least smiling. And he makes everyone else around him 
feel like smiling. He’s the Dalai Lama, the spiritual and 
temporal leader of Tibet, a Nobel Prize winner, and an 
increasingly popular speaker and statesman. Why is he 
so popular? Even after spending only a few minutes in 
his presence you can’t help feeling happier. If you ask 
him if he’s happy, even though he’s suffered the loss of 
his country, the Dalai Lama will give you an unconditional 
yes. What’s more, he’ll tell you that happiness is the 
purpose of life, and that “the very motion of our life is 
towards happiness”. How to get there has always been 
the question. He’s tried to answer it before, but he’s never 
had the help of a psychiatrist to get the message across in 
a context we can easily understand.
LAMA, D.; CUTLER, H. The Art of Happiness: a handbook for living. Putnam Books, 1998.
Pelo título e pela sinopse do livro de Lama e Cutler, 
constata-se que o tema da obra é
A o sucesso dos autores no Tibet. 
B a busca da felicidade no cotidiano.
C o Prêmio Nobel recebido por Lama.
D a liderança de Dalai Lama no Tibet.
E a discussão de Lama e seu psiquiatra.",UNDEFINED
"
QUESTÃO 93 
Cyberbullying is harassment through electronic 
means such as telephone text messages, social media 
such as Facebook and Twitter or online blogs and bulletin 
boards. In normal bullying, students are given a daily 
break from the torment as bully and victim each go to their 
separate homes. But for victims of cyberbullying, there is 
no reprieve, as the abuse enters into their private lives. In 
the US, there are at least 44 states that have anti-bullying 
laws on the books. While only six of them use the actual 
word “cyberbullying”, 31 others have laws that specifically 
mention “electronic harassment”.
Prosecution in the UK is a little more difficult. While 
all schools are required to have anti-bullying policies 
in place, cyberbullying itself is not named as a criminal 
offence. Offenders in the UK would have to be charged 
under various other laws, including the Protection from 
Harassment Act of 2003. This makes prosecution much 
more difficult.
Authorities agree that in order to stop cyberbullying, 
there has to be parental involvement. Parents need to 
be vigilant about their children’s access to technology. 
They should monitor their children’s use of social media, 
especially children under the age of 14. Bullies are not 
going to simply disappear, but parents can go a long way 
in protecting their children from being bullied.
Go! English, ano II, n. 14 (fragmento).
De acordo com o texto, nos Estados Unidos, alguns estados 
têm leis específicas para assédio via meios eletrônicos. 
Já no Reino Unido, a instauração de processos contra 
praticantes de cyberbullying é mais difícil porque
A as vítimas precisam recorrer a outras leis existentes, 
pois o cyberbullying não é considerado crime.
B as leis que regulamentam o uso da internet e dos 
meios eletrônicos de comunicação são inexistentes.
C os pais das vítimas não têm interesse em denunciar 
os agressores de seus filhos às autoridades 
competentes.
D os estudantes com idade inferior a 18 anos não 
podem sofrer acusações de prática de cyberbullying 
ou bullying.
E as leis como a de Proteção contra Atos de Assédio de 
2003 estabelecem que o cyberbullying não é crime.
*CINZ25DOM3*



2013
LC - 2º dia | Caderno 6 - CINZA - Página 4",UNDEFINED
"
QUESTÃO 94 
Disponível em: www.arcamax.com. Acesso em: 26 fev. 2012.
Tirinhas são construídas a partir de contextos sociais e podem promover reflexões diversas. Essa tirinha provoca no 
leitor uma reflexão acerca da
A divisão de espaço com os pais.
B perda da atenção dos pais.
C submissão aos pais.
D ausência dos pais.
E semelhança com os pais.",UNDEFINED

"
Questão 179                                                                    
Ronaldo é um garoto que adora brincar com números. 
Numa dessas brincadeiras, empilhou caixas numeradas 
de acordo com a sequência conforme mostrada no 
esquema a seguir.
 
 
 
1 
 
 
 
 
1
2
1 
 
1
2
3
2
1
1
2
3
4
3
2          1
 
 
 
... 
 
 
Ele percebeu que a soma dos números em cada 
linha tinha uma propriedade e que, por meio dessa 
propriedade, era possível prever a soma de qualquer 
linha posterior às já construídas.
A partir dessa propriedade, qual será a soma da 9ª linha 
da sequência de caixas empilhadas por Ronaldo?
9
45
64
81
285",matemática
